{"arguments":["--fixture","π"],"assumptions":["PBR-HOST-AX-002"],"bounds":{"event_count":1024,"event_count_per_process":256,"output_bytes":1048576,"path_bytes":4096,"process_count":16,"socket_address_bytes":128,"symlink_hops":40,"tracee_string_bytes":4096},"completion":"incomplete","environment_names":["LANG"],"events":[{"architecture":"x86_64","class":"openat","error":13,"object_after":{"device_major":8,"device_minor":1,"inode":42,"mode":"100644","mount_id":7},"object_before":{"device_major":8,"device_minor":1,"inode":42,"mode":"100644","mount_id":7},"operands":{"buffer_bytes":null,"directory_fd":-100,"flags":0,"kind":"path","mask":null,"mode":null,"path":"config","resolve":null},"process":1000,"resolution":"stable-candidate","resolved_path":"/workspace/config","result":null,"sequence":0},{"architecture":"x86_64","class":"connect","error":1,"object_after":null,"object_before":null,"operands":{"address":{"bytes_hex":"020001bb7f0000010000000000000000","family":"inet","length_bytes":16},"descriptor":3,"kind":"socket-address","payload_bytes":null},"process":1000,"resolution":"unresolved","resolved_path":null,"result":null,"sequence":1}],"execution_id":"00112233-4455-4677-8899-aabbccddeeff","execution_profile":"diagnostic","gaps":["event-limit"],"launcher":{"mode":"0755","role":"launcher-binary","sha256":"sha256:2222222222222222222222222222222222222222222222222222222222222222","size_bytes":2},"mechanism":"linux-ptrace-syscall-v1","observer":{"mode":"0755","role":"diagnostic-observer","sha256":"sha256:3333333333333333333333333333333333333333333333333333333333333333","size_bytes":3},"platform":{"architecture":"x86_64","kernel_release":"fixture","landlock_abi":11,"operating_system":"linux"},"reusable":false,"runtime":{"mode":"0755","role":"runtime-binary","sha256":"sha256:1111111111111111111111111111111111111111111111111111111111111111","size_bytes":1},"safe_policy":false,"schema":"proofbound-runtime-diagnostic-receipt/1","seed_plan":{"mode":"0644","role":"execution-plan","sha256":"sha256:4444444444444444444444444444444444444444444444444444444444444444","size_bytes":4},"target":{"mode":"0755","role":"runtime-executable","sha256":"sha256:5555555555555555555555555555555555555555555555555555555555555555","size_bytes":5},"trusted_computing_base":[{"identity":"fixture-observer","role":"diagnostic-observer"},{"identity":"fixture-filesystem","role":"filesystem"},{"identity":"fixture-hardware","role":"hardware"},{"identity":"fixture-kernel","role":"linux-kernel"},{"identity":"fixture-launcher","role":"runtime-launcher"},{"identity":"fixture-supervisor","role":"runtime-supervisor"}]}
